{
 "status": "ok",
 "message": "",
 "phase_signature": "VAPOR",
 "model_version": "P02-L-form-v1",
 "constants_sha256": "0d91ffeeed88e9b9c03be1b62a4827927764fb6d9d49d2e06b59aeada29bdccc",
 "state_sha256": "ed1bb2beddfdbb5367d6e41fc33a91b17d3e13dcc8d015072da126db56d57587",
 "equation_ids": [
  "bal_A",
  "bal_B",
  "bal_C",
  "Vdef",
  "Ldef",
  "eq_A",
  "eq_B",
  "eq_C",
  "kdef_A",
  "kdef_B",
  "kdef_C",
  "hdef_A",
  "hdef_B",
  "hdef_C",
  "energy",
  "tspec",
  "pspec"
 ],
 "values": [
  0.0,
  0.0,
  0.0,
  0.0,
  0.0,
  0.0,
  0.0,
  0.0,
  -0.0,
  4.440892098500626e-16,
  6.661338147750939e-16,
  -0.0,
  -0.0,
  -0.0,
  0.0,
  0.0,
  0.0
 ],
 "counters": {
  "K": {
   "value_calls": 1,
   "jacobian_calls": 0
  },
  "H": {
   "value_calls": 1,
   "jacobian_calls": 0
  }
 },
 "accuracy": "exact-double"
}
